<?xml version="1.0" encoding="UTF-8"?>
<!DOCTYPE pr SYSTEM "PR.dtd">
<pr>
    <header>
        <keyname>TPC3/DAW-2020</keyname>
        <title>DTD and XSLT</title>
        <begindate>October 2020</begindate>
        <enddate>November 2020</enddate>
        <supervisor url="http://www4.di.uminho.pt/~jcr/">José Carlos Ramalho</supervisor>
    </header>
    <workteam>
        <worker>
            <name>Angélica Freitas</name>
            <email>a83761@alunos.uminho.pt</email>
            <number>a83761</number>
        </worker>
    </workteam>
    <abstract>
        <paragraph>
            <bold>DAW</bold>'s (Web Application Development) XSLT project about archeosites. 
        </paragraph>
    </abstract>
    <deliverables>
        <link url="file:///home/angelica/DAW2020/tpc3/arq.dtd">DTD</link>
        <link url="file:///home/angelica/DAW2020/tpc3/arq.xml">XML</link>
        <link url="file:///home/angelica/DAW2020/tpc3/arq.xsl">XSLT</link>
    </deliverables>
</pr>